{
  "schemaVersion": "1",
  "workflow": "expert",
  "expert": "Evidence Reviewer",
  "model": "synthetic-golden-regression-fixture",
  "summary": "Synthetic baseline review result for deterministic structured-result regression checks.",
  "overallSeverity": "medium",
  "findings": [
    {
      "title": "Escalation wording overstates certainty",
      "summary": "The synthetic summary implies a definitive blocker even though the evidence only supports a caution.",
      "severity": "medium",
      "recommendation": "Restore caveated wording before treating the issue as blocker-grade.",
      "evidence": [
        "Synthetic evidence packet",
        "Escalation note"
      ]
    },
    {
      "title": "Action boundary is explicit",
      "summary": "The review result reports concerns without deciding approval, publication, routing, or remediation ownership.",
      "severity": "low",
      "recommendation": "Keep downstream policy and action mapping in the embedding repo.",
      "evidence": [
        "Boundary note: synthetic fixture only"
      ]
    },
    {
      "title": "Reviewer scope is documented",
      "summary": "The synthetic packet says the comparison is for review-output behavior only.",
      "severity": "low",
      "recommendation": "Keep routing, approvals, and remediation ownership in the embedding repo.",
      "evidence": [
        "Boundary note: comparison fixture only"
      ]
    }
  ],
  "provenance": [
    {
      "label": "Content source",
      "value": "Synthetic structured-result golden-regression baseline"
    },
    {
      "label": "Review surface",
      "value": "Structured review-result comparison fixture"
    },
    {
      "label": "Privacy boundary",
      "value": "No real source paths, tracker identifiers, account data, private facts, or domain policy"
    }
  ],
  "markdown": "# Summary\nSynthetic baseline review result for deterministic structured-result regression checks.\n\n## Findings\n- Medium: Escalation wording overstates certainty.\n- Low: Action boundary is explicit.\n- Low: Reviewer scope is documented.\n\n## Boundary\nThis fixture uses only generic labels and leaves approval, routing, remediation, and publication policy caller-owned."
}
