{
  "schemaVersion": "1",
  "workflow": "expert",
  "expert": "Evidence Reviewer",
  "model": "synthetic-reviewer-contract-fixture",
  "summary": "Synthetic reviewer-contract fixture with generic evidence labels, stable finding keys, and caller-owned action boundaries.",
  "overallSeverity": "medium",
  "findings": [
    {
      "key": "evidence-support-gap",
      "title": "Evidence label needs clearer support",
      "summary": "The synthetic packet asks the reviewer to check whether a claim is supported, but the shared fixture uses only generic evidence labels instead of real source names or source paths.",
      "severity": "medium",
      "recommendation": "Ask the caller-owned workflow to provide a sanitized evidence summary before treating the claim as reviewable.",
      "evidence": [
        "Evidence label A",
        "Synthetic claim note"
      ]
    },
    {
      "key": "external-action-readiness-unsupported",
      "title": "External-action readiness is unsupported",
      "summary": "The synthetic packet includes an external-action readiness claim, but the shared fixture includes no approval, release, or routing evidence and cannot authorize a real-world step.",
      "severity": "medium",
      "recommendation": "Keep approval, routing, remediation, and publication gates in the caller-owned workflow until sanitized action evidence is supplied.",
      "evidence": [
        "Evidence label C",
        "Boundary note: caller-owned action gate"
      ]
    }
  ],
  "decision": {
    "schema": "peer_review_decision_v1",
    "verdict": "accept_with_follow_up",
    "confidence": "medium",
    "blocking": false,
    "max_severity": "medium",
    "summary": "The fixture is safe to keep as a reviewer-contract example, but it still needs clearer evidence support and caller-owned follow-up handling.",
    "blocking_findings": [],
    "non_blocking_findings": [
      {
        "key": "evidence-support-gap",
        "title": "Evidence label needs clearer support",
        "summary": "The synthetic packet asks the reviewer to check whether a claim is supported, but the shared fixture uses only generic evidence labels instead of real source names or source paths.",
        "severity": "medium",
        "recommendation": "Ask the caller-owned workflow to provide a sanitized evidence summary before treating the claim as reviewable.",
        "evidence": [
          "Evidence label A",
          "Synthetic claim note"
        ]
      }
    ],
    "required_before_merge": [],
    "follow_up": [
      "Keep approval, routing, remediation, and publication gates in the caller-owned workflow."
    ],
    "next_step_actions": [
      "collect_more_evidence",
      "track_follow_up"
    ]
  },
  "provenance": [
    {
      "label": "Live source check",
      "value": "Synthetic review packet",
      "freshness": {
        "signal": "live_refresh",
        "asOf": "2026-04-26T17:54:10.790Z",
        "note": "Validated during the same synthetic review run."
      },
      "authority": {
        "signal": "source_of_truth",
        "note": "Primary packet under review."
      }
    },
    {
      "label": "Current-state mirror",
      "value": "Caller-maintained mirror digest",
      "freshness": {
        "signal": "mirrored_current_state",
        "asOf": "2026-04-26T17:30:00.000Z",
        "note": "Mirror timestamp comes from the caller-owned digest."
      },
      "authority": {
        "signal": "derived_summary",
        "note": "Useful context, but not the source of truth."
      }
    },
    {
      "label": "Historical boundary note",
      "value": "Earlier comparison snapshot",
      "freshness": {
        "signal": "historical_context",
        "asOf": "2026-04-20T12:00:00.000Z",
        "note": "Retained only for change-over-time context."
      },
      "authority": {
        "signal": "advisory_boundary",
        "note": "Do not treat this note as approval or routing authority."
      }
    },
    {
      "label": "Evidence basis",
      "value": "Generic evidence labels only"
    },
    {
      "label": "Privacy boundary",
      "value": "No real source paths, tracker identifiers, account data, or domain policy"
    }
  ],
  "markdown": "# Summary\nSynthetic reviewer-contract fixture with generic evidence labels and stable finding keys only.\n\n## Findings\n- Medium: Evidence label needs clearer support.\n- Medium: External-action readiness is unsupported.\n\n## Boundary\nNo target selection, private naming, policy thresholds, routing, or domain interpretation is part of this fixture."
}
