{
  "schemaVersion": "1",
  "workflow": "expert",
  "expert": "Evidence Reviewer",
  "model": "synthetic-evidence-pack-diff-fixture",
  "summary": "Synthetic baseline review result for compact evidence-pack diff checks.",
  "overallSeverity": "medium",
  "findings": [
    {
      "key": "evidence-pack-traceability",
      "title": "Evidence-pack traceability needs one clearer label",
      "summary": "The evidence pack names a reusable concern but still relies on a coarse evidence label.",
      "severity": "medium",
      "recommendation": "Keep the finding generic and add one clearer sanitized evidence label before caller-owned routing.",
      "evidence": [
        "Synthetic evidence pack",
        "Evidence label A"
      ]
    },
    {
      "key": "caller-owned-routing-boundary",
      "title": "Caller-owned routing remains explicit",
      "summary": "The comparison fixture leaves approval, routing, and remediation ownership outside AIQL.",
      "severity": "low",
      "recommendation": "Keep downstream routing in the embedding repo.",
      "evidence": [
        "Boundary note: fixture only"
      ]
    }
  ],
  "provenance": [
    {
      "label": "Comparison scope",
      "value": "Compact evidence-pack comparison fixture"
    },
    {
      "label": "Privacy boundary",
      "value": "Generic evidence labels only"
    }
  ],
  "markdown": "# Summary\nSynthetic baseline review result for compact evidence-pack diff checks.\n\n## Findings\n- Medium: Evidence-pack traceability needs one clearer label.\n- Low: Caller-owned routing remains explicit.\n\n## Boundary\nThis fixture uses only generic labels and leaves approval, routing, and remediation caller-owned."
}
